feedback_id,enrollment_id,rating,comments,submitted_at
412,428,1,Industry nothing rather. Two hair describe hundred candidate. Probably whom it job likely different house.,2025-05-01 06:28:07.744970
78,459,1,"Under require page claim future in. Truth ten seven both happy central group line. Send cultural whatever computer on fast play.
Issue radio especially road get car party. All office less politics.",2025-05-21 14:33:12.738672
425,4,5,Tonight garden maybe forward reason. Worker season figure they yeah get. Memory who yet spend raise child above.,2025-04-16 19:48:48.837515
809,449,5,"Important produce just raise enough onto try. Those north trouble upon.
If do them although per environmental medical nearly. Line Congress must city system story.",2025-01-10 07:55:18.110778
904,391,5,"Next according television next sense make real use. Girl sister their rate drop marriage worker.
Across great western unit begin. Off difficult happen high serve.",2025-04-27 16:46:31.172259
440,326,2,It grow husband short year term. Tough building child usually sea upon full. Body himself home message woman. Stock determine human find discussion military ability.,2025-04-10 16:24:00.372306
466,615,2,"Scientist culture ability to. At computer doctor up high southern.
High she past especially old. Still quality political other begin war. Evening realize per probably.",2025-04-03 22:55:00.389596
38,402,3,Law go simple improve language. Need when simple. Involve education little direction exist.,2025-02-25 18:26:50.645439
769,11,1,Rich consumer type Republican organization. Charge read management production up our. Drug toward such.,2025-02-28 15:49:33.094472
229,815,4,Keep production suffer life chair senior. West hour less music. Region again debate take one them.,2025-01-05 14:07:21.920077
430,819,5,"Check election order everything stuff detail. Second until direction opportunity very analysis. Phone nor as year look floor.
Its professor while seven.
Relationship easy picture enough.",2025-06-13 17:30:05.060606
493,112,2,Individual so attack now minute technology only. Alone subject development best student describe concern. Human participant seat give especially. Wind natural customer letter finish campaign.,2025-03-18 04:03:31.370552
460,140,2,"Fast pick purpose expert. Structure point especially. First natural without any remain support.
Employee argue home exactly. Effect fine speak majority large. Interest college anything relationship.",2025-01-25 20:50:20.856615
913,590,5,"Control work name Congress. Understand relate church serve can street.
Model similar sometimes talk remember. Reveal so suggest.
Cold measure defense mouth manage camera. Mouth tonight throw action.",2025-01-09 19:53:06.540547
364,805,4,Eat report to product outside they eye. Challenge project happen white maybe read card look.,2025-02-05 14:25:37.278769
905,412,5,"Meeting space military tonight. Structure positive true else feeling trade money. Why learn attention cut billion.
Stay describe time. Community whole growth speech across yard admit parent.",2025-01-03 08:21:36.216542
512,3,2,Good decade TV culture continue. Many character option imagine. Wait technology town approach today all positive us.,2025-04-02 23:00:03.007443
810,92,3,"Language provide parent information call prevent visit skin. Significant stuff section lot rather beyond share energy. Play meeting movie avoid.
Address simply catch but his within though finish.",2025-04-03 04:18:03.492777
521,648,1,"Identify within street national sea knowledge. Certainly walk camera debate western store office.
Education idea across player appear. Then police choice cell.",2025-03-27 07:58:06.439206
687,746,4,"Popular stock memory challenge. Century alone popular break.
Environment few voice thank local option five. Level generation since also himself with garden mention.",2025-02-26 02:08:08.910188
682,10,1,"Series think industry specific show pressure local. Raise suggest six claim analysis school. Probably up strategy receive rate oil defense.
Your outside wish community kid official within.",2025-03-20 22:39:02.720836
800,112,4,Group eat soon must toward family event dark. Firm again court culture story suggest.,2025-01-14 04:35:30.783015
585,66,3,Media adult process message. Yes too dog among believe value fine staff. Report sign office until particularly when. Everyone city contain week carry.,2025-01-21 18:18:16.828238
214,67,4,"Together record system term. Say about century debate officer about camera machine.
Five detail company first thing discuss power.",2025-01-16 15:56:06.674595
237,787,5,"Century energy safe crime social school enter. Heavy anything strategy hope return near.
Charge alone pattern might offer indeed light. Wrong best I medical level president. Cut drive out.",2025-04-16 07:19:43.724557
21,617,5,"Go woman small. Window key military. Stay century law before everybody. Hot scene view today father.
Buy many partner pressure discover carry TV drive. Machine century suddenly.",2025-03-22 11:59:21.457852
143,152,3,"Chance of enter deep walk cause trouble movie. Stuff federal like be.
Big early amount team. Beat start say either none heavy down business. Way sister civil market value during difficult religious.",2025-04-06 03:34:17.374398
27,910,5,"Center without around four.
Town worker present defense become result. Their defense floor themselves she. Official natural can forward notice mouth.",2025-01-02 05:42:16.778461
381,370,2,"Remain cup they enter identify participant. Wear commercial administration fund remain.
Job follow result. Form single camera political economic.",2025-02-18 18:06:13.845258
174,713,3,"Everything buy protect front why. Behavior send laugh.
Hear prove leave national visit. Address above form debate name may.
Bill pattern scientist early. Range know close election.",2025-04-16 06:20:01.624824
448,794,3,"Inside water do get finish pick shake level.
Evening clearly these tonight food age. Perform walk expert easy word learn military.",2025-03-22 16:14:01.502825
950,602,3,"Rest really wait if. Debate into name response garden.
Pattern story term show industry.
Ask although get poor herself. Executive will network physical play. Child push it why research wind yard.",2025-02-17 14:53:42.236244
508,266,5,"When also long time blood. List run safe figure. Allow star forward leave art practice.
Us lawyer finally until help. Interest amount understand hard.",2025-04-10 22:54:19.373192
794,719,2,"Star various item boy response. Would road collection big talk role instead.
Phone when room network. Role yes to more.",2025-01-21 16:44:15.645298
507,831,3,"The common prevent spend. Customer plan maybe manager place fly.
Provide drug son show whatever simple wrong newspaper. Point discuss almost.",2025-01-29 03:01:52.774979
165,740,3,"Particular available expect really amount accept sometimes. Forget three doctor nature.
Poor send through. Then probably or which white get bring.
Hair look too reveal safe PM.",2025-05-29 12:55:49.124463
520,383,3,Mrs interesting less economy fire education. Heart message matter position water. Instead room seven reveal whole.,2025-06-11 17:44:18.701402
663,891,3,Suffer team word major western education. Remember rich yeah simple guess member. Spend practice organization fill can cause.,2025-01-17 23:41:57.438076
319,155,2,"Quality fill final oil Congress according senior if. Before talk want it manage.
Investment day interest side. Author carry focus fact special. Early leave camera future despite child.",2025-01-28 22:18:10.706779
522,125,1,Little drive require time. Anything season hospital machine. Religious around both place.,2025-05-15 08:53:43.375582
56,263,5,"Than probably before might someone young learn. Cause compare difficult discuss. Trouble key between seem.
Care door natural produce team operation. Top worry there similar adult range true.",2025-05-11 23:17:12.417919
511,27,3,"Yeah certain return suddenly wish loss. Ability no affect catch.
Fly find create artist. Serve rule thus.",2025-02-22 01:23:00.640630
512,672,4,"Since laugh model make speak. Thank kitchen move husband friend idea thus.
Degree training level. Idea school still up radio.",2025-05-19 19:21:00.054865
468,812,1,"Although say bed second behind vote case.
Position hand benefit major friend. Data difference others know expert cell style. See country response concern.",2025-05-13 00:06:38.973173
545,214,5,Buy assume part father himself research general college. Night want according speech. Civil center newspaper note quite lawyer thank attack.,2025-04-06 00:49:28.832677
627,616,4,Inside series tell thank. Politics catch information where car usually growth.,2025-06-09 17:28:41.367115
2,575,1,"Song computer respond current wife. Good her few eight. Still ten agree weight statement statement unit in.
Economic attack food laugh newspaper part better. Specific city paper part.",2025-05-28 03:28:40.586465
95,809,4,"Field off government forget evidence short star feel. Goal rich study others.
It start now. Spend compare of Mrs possible. Protect something camera.",2025-02-02 21:38:30.793759
832,508,5,Nothing defense customer family. Form fight century office indeed area. Something book notice society truth class.,2025-01-19 17:18:54.677401
537,427,4,People conference indicate actually small case middle. Project establish indicate very art eat. Cover program reason environmental he. Around enter blue expect true.,2025-04-21 01:49:48.344995
33,533,5,Rate effect remember memory say together. Matter instead need conference. Expert suggest school far.,2025-04-11 07:27:26.350786
876,172,1,"Exist improve son less. Attention both hour factor. Interesting phone on far.
Not identify score. Happy thought early president board bring painting. Group member it chance our.",2025-03-20 13:32:50.957418
887,677,3,Expert thing bed among understand else represent. Yard tough employee situation red. Sound late camera provide. Various exactly several effect adult run.,2025-05-18 09:57:56.942545
464,840,1,"Factor culture pretty drug north shake property.
Expert assume every walk degree rise laugh citizen. Coach yard treat. Have approach difference difficult.",2025-01-17 03:48:40.216171
781,226,2,"Over before study. Its practice how save several model think five.
Camera federal family I miss. Leader note understand. News film building finish relate.",2025-04-02 16:19:43.526059
384,421,1,"View adult financial. Body program after scientist ever travel feeling. Customer season owner traditional fill.
Simply wait similar blood really child lead.",2025-03-24 23:15:17.472633
468,469,5,Serious phone avoid stand stop. Store community together far enough ability citizen. Whom box political herself society position.,2025-04-27 09:19:56.948470
689,227,4,Amount will data school no air. Win change resource occur music item land. Although well far summer.,2025-05-06 17:43:34.206322
94,537,5,"Try happen show garden worry put he ask. Guess what edge change structure.
Career state six born old nice per pattern. Eight energy continue industry best change.",2025-04-26 16:57:15.105014
938,842,4,"Carry kid why nothing woman subject.
Person current able report director. Wall subject management interesting idea if finally cold. Business performance city test direction call.",2025-04-25 11:03:27.592624
608,499,3,"Health television perhaps where dinner. Determine someone hit.
Soon current by write north product well. Guess them purpose partner son air out.",2025-02-04 10:30:16.932918
408,291,2,"Girl their or city. Call various offer exist.
Of structure blue end require. Modern end blue never newspaper argue game.",2025-03-03 07:10:20.660105
757,478,4,"Or try such or much tree book. Network deep politics I American tonight try PM. They now population in full.
Event under same commercial. Itself tax activity mission industry skin.",2025-02-24 09:32:23.293963
435,658,1,"Whose better themselves field number. Hot chance foot candidate. Always now life natural. Interesting easy perhaps best company.
Last dark power energy. Course laugh civil degree now go energy.",2025-03-07 01:34:19.366724
366,208,4,"Fire growth alone until sell occur person social. Apply western feeling.
Too high inside. Son and give. Per second add picture.",2025-04-11 02:59:29.023696
903,804,2,"Already yet professional choice manage of catch. Hit look lay score inside.
Success federal movement down under. Dream memory evening small focus. Worker store successful field crime drug.",2025-02-13 14:11:34.664513
633,567,3,Current page skill indeed four interview. American under product occur add beat. Which worry door tonight.,2025-01-05 07:05:50.754130
125,705,2,Discussion would arrive teacher where close democratic. Team middle model pick. Type focus discuss our five purpose everything.,2025-04-10 13:44:27.723394
925,48,5,Anything discover occur teach sense speech lawyer west. Example modern yes woman at kid box run. Clearly increase much right.,2025-04-04 05:26:39.892919
46,39,2,"Trial other night somebody process analysis. Know rich medical carry music. Until new enter message reason.
Capital cover feel debate family among. Nearly water realize put happen discover.",2025-05-09 14:12:26.229521
983,831,3,"Exactly than later analysis yet. However picture agree pass report through.
Daughter main both purpose ready become leader.",2025-06-12 17:57:12.697456
912,824,5,Available include there floor run bag should. Future people require quality information citizen without Mrs. Upon operation prevent manage line return.,2025-01-01 16:45:41.661115
982,19,5,"Role pull to wear southern lot consider stay. Goal join reduce allow eat side. Another heart others bring.
Listen another affect wear.",2025-02-07 13:44:13.407081
564,201,2,Six manager son beyond change. Rise pick suggest woman suggest question. Six night whether model citizen government big increase.,2025-04-14 17:00:54.915049
57,615,3,"Eight arm seven interest enter. Over role score throw name have TV environment.
Artist fact year. Evidence today case friend daughter interest. Produce class PM do network expert relationship.",2025-03-03 12:36:27.426032
851,699,4,"Very well religious those report reason. Society attention heavy debate cover.
Practice town billion painting peace half. Group indeed feel should. Into color later case less important.",2025-02-28 14:03:58.103415
771,77,4,"Reason sure act pay general.
Run its near really. Little Mr population add age letter religious. Money purpose TV between camera.",2025-04-18 09:52:07.949320
772,632,3,Offer present pretty language. Environment different some another run wall force.,2025-04-22 05:35:39.202269
71,678,1,Majority bit instead smile happen successful human. Public according understand happen begin actually. Data interesting eat practice throw receive.,2025-04-16 11:46:40.416778
780,983,2,"Film kitchen environment. Watch wrong pick structure wrong figure continue.
Whom fast late surface concern law. Share present spend make garden. Gas any manager political keep attack behavior.",2025-03-19 09:13:13.953306
214,773,5,International range arrive figure son crime Mrs design. Measure brother approach five. Later role change.,2025-05-17 08:52:49.102256
69,633,4,Strong term main feeling bag. Short research despite approach. Way face manage every. He under body phone would hard movement.,2025-04-18 17:34:54.172115
589,936,5,"Next week scientist recognize so relationship. Agent dark sound again professor operation next. With team front mother.
Left piece time on expert must small. Better those ability serve least mother.",2025-05-26 22:24:50.020087
189,369,4,Civil audience drive may. Least building military seem. Glass type structure so magazine worker.,2025-02-06 20:39:44.355880
750,540,5,"Watch religious star head full thing daughter indicate. First investment course lose since amount suggest. Bit mind race born.
Country toward claim civil inside friend. Push arrive body modern bit.",2025-02-02 20:39:37.913399
285,279,1,True listen art consider social example state into. Deep travel baby cover.,2025-04-29 16:55:16.911510
856,329,3,Water happen debate. Firm person black because song.,2025-03-24 03:17:27.564272
399,854,4,"Base service stand measure. Capital culture their perhaps bill.
Name ability population number campaign or. Recent type rest name. Unit difficult matter police anyone.",2025-04-28 05:03:24.188085
712,996,5,"Operation walk according party establish. Address agent life true. Change area either.
Start wonder space particular. Walk four stop part agency stock window safe.",2025-02-12 09:36:55.915673
525,459,5,"Partner seek up.
Stuff rock foreign pressure maybe. Mention detail enough suddenly.
Without some effort red forward. Event help born baby culture. Range statement step ever.",2025-04-26 01:25:04.358823
432,595,1,Institution wait maybe before far many thing. Finally pretty well list.,2025-02-09 03:06:05.873229
316,699,5,"Weight main fly conference. Bit data guy think condition source discuss. Tell method together purpose either.
Base arm upon one start. Thousand a rich open person. Tv common once vote wrong.",2025-03-06 00:41:08.179264
922,215,1,"Possible left car it large rock. Anything notice season probably office another perform view.
Others throughout attention.
Forward against federal hot here.",2025-04-18 10:44:13.895402
366,140,4,Use friend attack guy address chair. Everybody camera treatment class game. Develop west dog animal suddenly property name.,2025-01-30 14:18:36.628250
156,754,4,Money lose ago cost. All glass loss when forget from be player. Ready majority peace fish.,2025-05-22 20:05:31.991322
6,692,3,Back although teacher story. Thing few similar.,2025-02-21 18:39:49.249074
632,243,1,"More low one knowledge resource. Chair maybe hold participant parent star too.
Wind news analysis throughout every husband certain. Politics toward people tell them. Well project science understand.",2025-01-13 07:27:35.938669
897,513,1,"Fear already this blue well.
Law international couple word. Behavior indeed marriage why law.",2025-03-23 09:48:49.058607
404,620,1,"Term management campaign. Decision dinner physical.
Mean item sound left result. Whom occur industry data strong relationship hand coach.
Newspaper thought must. Can beautiful arrive usually can.",2025-02-08 09:07:44.385412
758,247,2,"Join that thing owner where treat member.
Black budget certain choose own father. Employee last total type. This painting job lay whose.",2025-02-28 17:26:02.764867
